"","movie","point","review"
"326","다만 악에서 구하소서","9","스토리는 뻔하나  시간 후딱감 액션좋음 그런데 15세 관람이상 액션인데  ? "
"327","다만 악에서 구하소서","9","잔인하고 액션씬 볼만해요 박정민배우 연기 인상적^^ "
"328","B급 며느리","10","기대를 많이 하고 본 영화인데 영화를 보자마자 너무나도 공감이 되는 많은 이야기가 아직도 기억에 많이 남아있습니다. 어쩌면 우리 엄마의 세대 이야기, 아니면 어른이 되어가는 10대 세대의이야기 일수 있는  이야기를 담은 영화는 많이 추천 합니다. 너무나도 감명깊게 봤고, 우리 모두 B급 며느리가 되보아요^^ "
"329","침입자","8","스릴있게 잘 봤어요 저는..괜찮은데요..? "
"330","용쟁호투","9","그 당시 코팅 책받침 모델은 여배우들만 있는 것 은 아니었다~! "
"331","다만 악에서 구하소서","10","이정재 배우님이 다했음... 근데 박정민 배우님도 다 한 느낌적인 느낌?ㅋㅋㅋ "
"332","다만 악에서 구하소서","2","액션만 있고 줄거리는 하나도없음액션도 지루하고 뻔함황정민 박정민 연기덕에 살았음 "
"333","다만 악에서 구하소서","4","나를 악에서 구하소서 ㅡㅡ애미야 국이 심심하구나 "
"334","엑시트","10","왜 이제서야 봤을까 너무 후회했다ㅠㅠ 정말 쫄깃쫄깃하고 현실성 있는 스토리까지 여러모로 감동적이였습니다 "
"335","다만 악에서 구하소서","7","한국 영화에서 볼수 없었던 신선한 액션 청불이었음 더 좋았을듯 "
"336","다만 악에서 구하소서","1","역대급 OOO기ㅣㅣㅣㅣ "
"337","다만 악에서 구하소서","10","황정민은 엘레베이터 싸움의1인자다 "
"338","반도","6","부산행 보다는 못하지만 포스트 아포칼립스적인 비쥬얼과 액션은 볼만했습니다. 좀비 시대에 좀비보다 더 무서운 존재는 오히려 살아남은 인간들끼리의 분열과 증오라는 점도 나름 신선했고요. 다만 아역들의 약간 닭살 대사와 마지막 신파극은 좀 아쉽네요. "
"339","다만 악에서 구하소서","8","최근 개봉한 한국영화중 젤 낫네.. "
"340","다만 악에서 구하소서","2","차라리 깔끔하게 또라이 두명의 추격영화로만 만들어도 괜찮았을텐데 영화 후반부터 같잖은 부성애 장면 나올때마다 맥 끊기고 너무 한숨나옴.. 스토리도 엉성하고 액션만 볼만함 "
"341","다만 악에서 구하소서","10","걍 존나재밌다 진짜봐라 영알못들 "
"342","다만 악에서 구하소서","10","황정민 이정재 박정민 연기는 깔게없음 "
"343","다만 악에서 구하소서","10","황정민, 이정재 배우는 믿고보는 최고의 배우지만 박정민 배우의 여장 연기는 정말 최고네요. 다시 보게 됐습니다. 정말 짱짱짱 "
"344","다만 악에서 구하소서","10","황정민이정재캐미굿굿!!! 리얼 감정몰입도 굿!!끝까지 지루함없는 완벽한 연출과 연기 독보적인 비주얼 이정재님^^!!! "
"345","반도","6","생각을 엄청 많이 하고 볼 영화는 아닌 거 같고 그냥 시간 때우는 정도로 생각하시고 보시면 편하게 보실 수 있는 영화인거 같아요. 연기가 어색하거나 하는 부분은 없었던 것 같고... "
"346","다만 악에서 구하소서","10","재밌음 ㅠㅠㅠㅠ "
"347","다만 악에서 구하소서","2","연기, 연출 훌륭하다. 10점 만점에 9점이상.다만 스토리가.. 난 진짜 스토리가 너무 아쉽다. 어차피 액션영화니까 스토리가 약해도 화려한 볼거리만 있다면 어느정도 점수를 먹고 들어가는거 알겠는데.. 그래도 너무너무너무 아쉽다. "
"348","다만 악에서 구하소서","10",""
"349","다만 악에서 구하소서","6","전박적 스토리와 연계성은 그럭저럭 이었지만.다만. 이정재의 연기력과 캐릭터 매칭이 좋았고. 관상때처럼 포스  뿜뿜!.. 그리고 박정민의 연기력 개인정하게된 영화..개인적으로 이 영화는  박정민에 의한 박정민을 위한 영화 ..박정민이 어떤 역할인지 알고 보면 잼 없을듯.. 극장앞에서 브루스윌리스가 귀신이래~를 듣고 식스센스 보는 느낌이랄까? "
"350","다만 악에서 구하소서","9","청불이 아닌게 아쉽다. "
"351","반도","10","기대하고 보면 재미없고 기대하지 말고 보면 킬링 타임용으로 적절함. 너무 머라하지 마세요 재밌음 "
"352","장화홍련전","6","누명을 쒸워 죽는게 너무 이상해  해명은 없는거야 "
"353","클래식","10","인생영화..아름다운 스토리와 아름다운 음악 그리고 조승우와 손예진의 연기력. 이기우의 코믹연기도 중간중간 좋았다. 로맨틱 그자체 조인성은 그냥 비맞는 씬으로 다했음 "
"354","강철비2: 정상회담","8","남북미 현재 상황에 일본,중국까지 5개국이 처한 상황을 실제 있을법한 일의 영화적인 해석을 더해 충분히 공감할수 있는 내용이었음.. 뭐 국뽕영화라고 하는데 국뽕보다는 현재 대한민국이 처한 상황을 직설적으로 늘어놨다도 보는것이... "
"355","강철비2: 정상회담","10","억지스런 유머코드가 좀 거슬리긴 했지만 끝나고 나오면서 많은 생각을 하게함.메세지도 뚜렷. 재미있었음.마스크쓰고 간만에 볼 가치있었음. "
"356","다만 악에서 구하소서","7","연기+액션+영상미는 정말 좋았지만 갑자기 억지감동 모먼트에 흐름깨지고 개연성도 잘.. "
"357","강철비2: 정상회담","8","난 나름 기대 안하고 밨다가 재밋게 보고 왔습니다. "
"358","다만 악에서 구하소서","10","재밌습니다 최근에나온 한국영화중 최고인듯 >3< "
"359","강철비2: 정상회담","4","편보다 무지 재미없음 "
"360","다만 악에서 구하소서","8","진짜 연기력이 다 했다 인력낭비 느낌 약간있지만 연기력 와 황정민, 이정재는 두말하면 입아픈데 빅정민 배우가 진심 연기 잘하는줄은 원래 알았지만 더더더더 놀람 스토리가 약간 뻔하고 노잼이지만 보라고 추천은 해주고싶은 영화 "
"361","강철비2: 정상회담","9","아이고 선동의 대가들 아니시랄까봐 선동들 열심히 하고 계시구나 영상미는 잠수함씬은한국영화 역대급이었는데 "
"362","푸시","6",""
"363","다만 악에서 구하소서","10","역시 황정민과 이정재 연기 합은 최고입니다. feat. 박정민 연기는 최고입니다. "
"364","다만 악에서 구하소서","10","황정민 액션장인 잼나다봐라 "
"365","베이비 데이 아웃","8","나보다 엄마가 더 좋아하던 영화 아기가 너무 귀엽다 "
"366","강철비2: 정상회담","8",""
"367","#살아있다","8","일단 유아인 연기 땜에 8점이에여..그리고 여자분 연기도 짱이고 마지막에 헬기 너무 띠용 이지만 너무 대충 빨리 넘어가는 느낌이였어여..그래도 재밌게는 봤어여!!..11000원이라는게 조금 아깝지만여ㅜㅎㅎ "
"368","반도","10","배우님들..연기 레전드에요ㅠㅠㅠ 그리고 저 평점 첨 남겨보는데 연기 진짜 대박이고 슬프고 무섭고 진짜 무서웠아유ㅠㅠㅠ글고 재밌었어요ㅜㅜ "
"369","다만 악에서 구하소서","4","개인적으론,,, 재미는 없고,,,, 연기력은 좋은,,,뭐 그냥 저냥 그런 영화 "
"370","다만 악에서 구하소서","10","최근에 본 영화중 최고인듯 "
"371","다만 악에서 구하소서","6","꽤나 잔인하던데 15세라니... 아이가 나오는 장면은 내내 불편했어요ㅠㅠ 너무 감정 이입이 됐나봐요 ㅠ 애기 트라우마 어쩔... 그리고 트젠은 무슨 죄... 결국 아이의 엄마도 되고 아빠도 되는 건가요..? 흑흑 너무 사이다가 없어서 별점 낮게 줌 ㅠㅠ "
"372","반도","5","연상호 '염력' + 강동원 '인랑' "
"373","다만 악에서 구하소서","10","스토리가 좀 개연성이 떨어지나 최근 본 한국작품중 제일 지루하지 않았어요~~~~킬링타임용으로 추천~! "
"374","타이타닉 2","1",".22를 위하여 이 글을 남깁니다 "
"375","다만 악에서 구하소서","6","0년만에 개봉한 짭저씨를 보는 느낌 "
"376","강철비2: 정상회담","7","바다 속에서 마주한 한반도 정세 "
"377","다만 악에서 구하소서","6","박정민씨를 다시 보게 된 영화스토리는 해바라기+아저씨(feat. 신세계) 인것 같아 몰입이 많이 되진 않았어요.뭔가 아쉬움이 많이 남는영화에요. "
"378","다만 악에서 구하소서","7","어차피 이렇게 될 줄 알았어도 재미있다. "
"379","다만 악에서 구하소서","8","재밌게 보긴 함. 액션과 연출, 빠른 속도감, 시원시원한 전개는 일품이지만 그 외의 것들은 좀 아쉬움. 극 초반 레이라는 이름 등장할 때부터 분위기 깨질 뻔 했음 + 진부한 스토리 + 주인공 둘의 결말은 깔끔하나, 그 외 인물의 스토리 매듭짓기는 애매.. "
"380","강철비2: 정상회담","10","배우들의 세심한연기  좋았어요~대통령님이 너무 잘생겼어요 "
"381","다만 악에서 구하소서","9","기도하는 심정으로 영화 보기 오랫만... 이거 애들이 보기엔 좀 잔인할텐데 ㅠㅠ "
"382","인셉션","10",""
"383","다만 악에서 구하소서","10","평론 믿지말고 보세요.  신세계 느낌도 나고 잘 만들어진 영화고 재밌습니다.    적당한 생략, 적당한 스피드..   억지 액션도 없고 캐릭터 나름 마다의 이유도 있고.. "
"384","다만 악에서 구하소서","4","진지하게... 4점짜리 영화입니다.아쉬움이 많은 영화네요.연기 잘합니다.근데... 스토리 무재미샷이 불편합니다.뻔한 스토리아마 우리늬 눈도 높아 졌을거라 생각합니다.옛날에 이렇게 만들었다면 재밌었겠지만,지금 시대에는 아닙니다. "
"385","남산의 부장들","1",""
"386","다만 악에서 구하소서","7","박정민 말투가 광희 닮음.. 요즘 나오는 영화들이 다 임팩트가 부족하네.. "
"387","정도","10","영화 보는중에 너무 닮아서 중지하고 검색하게 만든영화놀랍네요 연기도 잘하고 내용도 잘만들어지고 눈물도 나게하고잘봤어요 "
"388","빅쇼트","8",""
"389","다만 악에서 구하소서","8","미친놈과 더 미친놈의 만남 "
"390","다만 악에서 구하소서","10","지리네요 최근 본 한국영화 중에는 탑입니다. 보세요. 두번보세요. "
"391","반도","1","너무 실망햇어요 기대햇는디 "
"392","강철비2: 정상회담","8","미국 일본 중국 러시아 의한 남한과 북한의 처해진 상황을 알고있는 분들은 재미있게 볼수있는 영화다. "
"393","다만 악에서 구하소서","10","진짜 시간 순삭~재미있어요 "
"394","다만 악에서 구하소서","8","똥철네 반도보다는 훨씬 재밌네 "
"395","다만 악에서 구하소서","8","... 원스어폰어타임 인 타일랜드 보는 느낌. "
"396","킬 유어 달링","4",""
"397","강철비2: 정상회담","10","나름 잘 만듬..정말 시원스러운 영화다.. "
"398","다만 악에서 구하소서","10","기대보다존잼입니다  황정민 이정재 박정민ㅋㅋ 연기진짜최고에요 특히 이정재황정민 다시만난작품 진짜감동이에요 담작품에서도 또만나쓰면ㅜㅜ!! "
"399","다만 악에서 구하소서","10","진짜 배우들 연기 미쳤어요! 이거 진짜 명작 "
"400","나의 특별한 형제","10","영화 간단하게 보기 좋음 "
"401","다만 악에서 구하소서","10","이정재의 포스는 아무도  감당못해 "
"402","다만 악에서 구하소서","10","다들 연기도 너무 잘하시고 보는내내 긴장하면서 봤음 근데 박정민 보는 맛으로 본다 해도 과언이 아님... ㅋㅋ "
"403","다만 악에서 구하소서","10","꼭보세요 신세계 이후 괜찮은 영화가 나왔네여 "
"404","다만 악에서 구하소서","2","반도에 이어서 안봐도 될 영화네요..나름 믿고보는 배우들이었는데..어쩜 연기조차도 엉망인지..이정재의 목소리깐 어설픔과 박정민의 게이역은 재롱잔치수준- -; 개연성 제로의 서사까지..코로나 이후 한국영화의 질적인 저하가 심각한듯.. "
"405","다만 악에서 구하소서","6","개인적으로 주인공인 황정민에게 감정이입이 되지 않고 이정재에게 이입 됨. 그리고 9살짜리 아이가... 생존력은 높은데 왜 저항 한 번 안 하는지.. "
"406","다만 악에서 구하소서","10","좀처럼 집중못하고 몰입못하는 제가 2시간 순삭 당했습니다. "
"407","다만 악에서 구하소서","3","음.. 솔직히 스토리가 빈약하고 나오는 사람은 죄다 죽기만 했어요. 잔인한 걸 잘 못봐서 그런지 별로였습니다. 제가 원래 캐릭터의 서사를 중요시 여겨서 그런지... 배우들 믿고 봤는데... "
"408","반도","8","기대안하고 봤는데 재미있게 잘봤어요. 약간의 옥에 티라면 4년동안 방치된 차량이 방전되었을텐데 충격으로 경보알람이 울린것은 거슬렸어요. 그래도 재미있다고 추천할만합니다. "
"409","익스트랙션","8","액션은 진짜 쩔더라근데 스토리는 내가 짜도 이것보단 잘 짤듯 "
"410","강철비2: 정상회담","2","썩을 내용 후회합니다 보지마세요 "
"411","강철비2: 정상회담","2","북한에대한 미화가 오질라게 들어간 영화 "
"412","다만 악에서 구하소서","1","안기정이 재미있다 했는데 보다가 잠 "
"413","어쩌다 로맨스","2","너무 오글거리고 뻔한 전개 ㅜ 지루합니다 "
"414","업","10",""
"415","강철비2: 정상회담","1","정말 쪽팔리는 영화를 보았습니다.중간에 나올려다 ....대한민국 대통령을 인간적인 대통령으로 만들려다 바보로 만드는 것 같아 화가 났습니다.나라 어른의 권위도 없고 이웃나라에 대한 예의도 없고김정은만 부각시키는 북한 정권 홍보영화를 대한민국 국민이 돈주고 보다니 라는 생각이 들었습니다정말 화가 납니다. "
"416","다만 악에서 구하소서","7","네이버 평점도 영수증 들고 평점  올릴 수 있게 해야함. 9점은 아님 솔직히.. "
"417","불한당: 나쁜 놈들의 세상","10","이걸 이제야 보다니... 넘 꿀잼이네요 ㅋㅋ "
"418","다만 악에서 구하소서","10","여운이 많이 남는 영화였습니다.간만에 액션 몰입도 최고조였어요.최고!후회안해요. 꼭보세요! "
"419","강철비2: 정상회담","10","정말 재밌게 봤다 작금의 한반도 상황을 제대로 담은 잠수함 액션 캬~ 강추 "
"420","반도","8","너무  잘 보았습니다~~아이랑 봐서 폭력성은 조금 걱정 되었지만비교적 심하진 않았던것 같습니다 "
"421","다만 악에서 구하소서","10","이렇게 될지 알았자나. "
"422","다만 악에서 구하소서","7","재밌게보긴했는데 자동차 솔직히 너무방탄차 수준 아니냐? "
"423","윤희에게","10","추신. 나도 니 꿈을 꿔. "
"424","다만 악에서 구하소서","10","올해 내가 본 영화중에 이게 제일 재밌었음. 황정민 연기 너무 잘해서 감정이입 오졌음 "
"425","트루스 오어 데어","9","이영화 블룸하우스 제작이였네~ㅋㅋ 잼있긴한데~ 결말이 좀  별로임~ ㅋㅋㅋ "
"426","빅샤크: 매직체인지","10","너무재미있어요! 보고봐도 또 보고 싶내요. "
"427","다만 악에서 구하소서","5","시원시원한 액션을 기대했는데 피비린내랑 돈냄새만 난다 불쾌하다 "
"428","나이트 오브 컵스","10","""(초반부 나레이션) 한 때 영혼은 완벽하고 날개도 있어서 날개짓을 해 천국으로 날아오를 수 있었지. 헌데 날개를 잃고 땅에 떨어져 지상의 육신을 취했고, 이 육신 안에 살다보니 날개는 보이지도 않았어. 허나 날개의 뿌리는 여전히 있었고, 날개의 본질은 몸을 들어올리는데 있는 터. 우리가 아름다운 여인이나 남자를 볼 때 영혼은 천국에서 알던 날개의 눈부신 자태를 떠올려. 그러다 날개가 돋아나자 영혼은 날고 싶어하지만 어린 새처럼하염없이 하늘만을 바라보지.""----길잃은 인간은 방황하는 날개짓과 같이 술과 쾌락에 빠져 찬란했던 천국의 나날에 대한 기억들을 잊으려는듯 의지할 곳을 찾아 살아가게 되는 우리들의 인간상(크리스찬 베일), 여기서 바다와 진주가 말해주는 상징은 인간의 심연(깊은 내면) 속에 존재하는 진구(구원)의 열쇠를 상징하며, 현실의 꿈속에서 나를 방황케하는 모습들을 보여주지만, 세상의 고통 속에서도 끝내 인간의 본성은 잃어버렸던 날개의 기억을 되찾아, 나 자신으로서의 선택에 의해 꿈에서 깨어나 제스스로 삶에 다시금 발을 내딛는 모습으로 영화가 끝이 납니다. 인간의 욕망은 끝없이 피어오르고 그것의 대안만을 찾아다니며 채워지지도 않을 잔을 들고 나를 위안해줄 사람을 찾아 떠도는 것보다는, 지금 내가 바라보는 이 순간만을 이해하고 진정한 나로서 세상에 임하는 것만이 최선이다라는 이야기로. 허무하고 난해하기만한 영화이지만 카발라에 대한 감독의 생각들을 미학적으로 풀어내어 대중적이지 못하고, 관객과의 소통을 돕기 위한 어떠한 장치도 부족하지만, 언어로는 영상에 담아낼 수 없기에 타로카드와 같이 상징으로써 영상을 채워놓은 것이고, 객관적일 수 없는 이 이야기의 세계에 동참을 원하는 사람들에게는 침묵속에서 영상에 나타나는 여러 비유들을 매개로 하여, 내면세계로 동참할 수 있는 계기가 될 수도 있습니다. 그렇다고해서 영화 한 편을 바로 보기위하여 어떠한 학문을 공부하고, 이 영화를 다시 보려 시도한다는 것만큼 무지한 일도 없을 것입니다. "
"429","명량","5","그닥 감동적이지 못하고 CG도 자연스럽지 않고, 재밌지도 않았으므로 좋은영화로 보기 어렵네요 "
"430","다만 악에서 구하소서","3","모든 영화의 스토리가 신파에 집중되어 있음 특히 너무 의도적으로 황정민 죽이는게 참.... "
"431","다만 악에서 구하소서","1","점대 영화는 절대절대 아님. 액션은 그럭저럭 볼만하지만 스토리 뻔하고 유치함. 황정민 캐릭터 너무 진부하고 이정재 연기는 잘하지만 캐릭터와 대사들이 너무 오그라듬.. 그나마 볼만한건 박정민 트젠연기 하나..? "
"432","다만 악에서 구하소서","9","박정민 땜에 꼭 다시 보고 싶다 "
"433","욕망의 대지","9",""
"434","다만 악에서 구하소서","10","한국은 역시 스릴러지 재밌어요 "
"435","다만 악에서 구하소서","10","최고최고 개 꿀잼이였음 "
"436","다만 악에서 구하소서","10","박정민 배우 굉장합니다! 재미있게 잘 봤어요~ N차 관람까지 했습니다! 대박나세요~ "
"437","강철비2: 정상회담","6","오랜만의 영화관 나들이라 스토리와 상관없이 재밌게 봤습니다^^... "
"438","정도","10",""
"439","강철비2: 정상회담","10",""
"440","강철비2: 정상회담","6","강대국들 사이 서글픈 대한민국의 현실을 잘 그려내고자 애쓴거 같음. 초반엔 한반도 근대사가 좀 빨라서 따라가기 너무 버거웠음..재미는 뭐 중간중간.. 난 별 3.5 "
"441","다만 악에서 구하소서","10","옛날 아저씨 생각나네~  마지막은 아쉽지만...황정민,이정재 연기하나는 굿이다~  잘봤네요 "
"442","결백","10","스토리 신혜선 배종욱 신들린연기!엄지척 "
"443","강철비2: 정상회담","7","슬픈 나라를 잘 표현한것 같습니다 "
"444","나의 첫 번째 슈퍼스타","10","즐겁게 봤어요. 노래도 좋고 영상도 예뻐요.기분 좋게 볼 수 있는 영화예요. "
"445","반도","5","그냥 볼만은 할 정도네요 "
"446","에코","10","불의를 보면 못참는 성격, 그것 때문에 전과자라는 꼬리표를 달았지만 또다시 자기를 희생해서 남을 돕는.. 무모하지만 이기적인 현시대에선 멋있다. 사회약자에 대해 누군가는 관심을 가져야한다. 기대하지않은 오락영화에서 큰 깨달음을 주네요. "
"447","메이","7","캐리 삘 나는 작품. 개연성은 떨어져도 공포영화 매니아라면 볼 만함. "
"448","다만 악에서 구하소서","10","진짜 이정재보면 자꾸 지드레곤 생각났음ㅋㅋ개인적으로 재밌게봄  지루하지도 않고 "
"449","강철비2: 정상회담","4","어처구니없는스토리곽도원은 멋있었음 "
"450","교회오빠","10",""
"451","교회오빠","10",""
"452","애니멀 크래커","1","아... 너무 재미없었어요.. 같이 간 모두 ...잤어요....이건 뭔가요 ...너무해요 ... "
"453","반도","8","이것이 K-매드맥스다 Jane 이후로는 없던 일로 쳐준다 "
"454","다만 악에서 구하소서","8","연기력 미쳤다 스토리 몰입도 시간 가는줄 모르고 봄 "
"455","다만 악에서 구하소서","10","레이 등장씬부터bb 또 보고싶다 "
"456","반도","10",""
"457","가버나움","10","나보다 더 어른같은 12살 아이의, 현실을 사는 이야기. "
"458","다만 악에서 구하소서","7","진부한 클리쉐를 한국판 느와르로 소화시킨 볼만했던 액션물 한마디로 재미짐 "
"459","강철비2: 정상회담","10","1편보다도 더 재미있었어요. "
"460","반도","8","기대 안 하고 본 영화인데, 그래서 그런지 생각보단 재밌었어요. 다만 스토리와 연기력 그리고 영상미는 괜찮았는데 연출이 너무 아쉬웠고, 억지로 껴 넣은 신파도 보는데 거슬렸어요. "
"461","반도","1","하..진짜 수준개떨어지네.. "
"462","반도","2","강동원잘생겼다그외 희대의망작 "
"463","반도","5","""JANE이 우릴 구하러 올거야""                                 연감독 노린건가... 무리수 같은데... "
"464","강철비2: 정상회담","2","영화 보면서 쓴다 진짜 개 노잼이다 "
"465","강철비2: 정상회담","10",""
"466","다만 악에서 구하소서","8","액션신 리얼한 영상미 잘 그려낸듯개인적으론 황정민 배우 무거운 연기보단 베테랑이나신세계같은 가벼운듯한 액션이 더 잘 어울리는듯 "
"467","다만 악에서 구하소서","10","다시 보고 싶은 영화! 이정재 황정민 박정민의 연기력이 진심 최고였습니다 "
"468","다만 악에서 구하소서","8","배우들의 연기가 인상적이네요 볼만한 영화 입니다 "
"469","B급 며느리","2","완전 미친 며느리네요모르는 어른한테도 그렇게는 안 할 것같아요 "
"470","다만 악에서 구하소서","8","오늘봤는데 나는 왜 자꾸 아저씨가 생각나는지 ㅎㅎㅎ잘 만든 영화입니다. 시간순삭영화~추천합니다 "
"471","소리꾼","2","* 뻔한 내용~ 영화평 좀 성의있게 써라, 박푱시기는 밥은 먹고 다니냐?ㅋㅋㅋ "
"472","다만 악에서 구하소서","10",""
"473","날씨의 아이","8","도시...빌딩...여름...비...구름...싱그러운 초록색...낯선 두 사람(가출 소년과 비밀스러운 소녀)의 운명같은 만남과 사랑...역시 신카이 마코토 감독님 스타일의 정교하고 싱그러운 그림체... "
"474","미드나잇 인 파리","10",""
"475","알리타: 배틀 엔젤","6","0세이하만 보시길 추천. 12세 관람가라더니 진짜 딱 어린이용으로 제작했나 생각했음. "
"476","목소리의 형태","1","이건 뭐 재미도 없고 감동도 없고 아무것도 없고... 기분만 나쁘고... 무슨 말을 하고 싶른 건지도 모르겠고... 걍 처음부터 끝까지 나에게 똥만 줌 그리고 괴롭히는게 의외로 수위가 높아서 초반부터 기분 팍 더러워짐 그래서 뒤로 갈수록 무슨 내용이 나오든 짜증난다는 생각밖에 안 들어서 그런걸수도 잇을듯?? 아무튼 진짜 보지마라 이거 재밋다는 새끼들 다 총으로 쏴죽여버리고 싶을 정도로 짜증나고 기분나쁘고 그냥 진짜 짜증남 영화가 제발 보지마 "
"477","다만 악에서 구하소서","8","배우들연기가 대박이다  애매한스토리와개연성부족한영화를 배우들이살렸다  특히 박정민!! 최고다 "
"478","반도","10","너무 재밌었어요ㅜㅜ 다들 연기도 잘하시고 짱짱 "
"479","강철비2: 정상회담","10","해군으로서 너무 재밌게봤음 "
"480","다만 악에서 구하소서","4","한국판 익스트렉션. 하지만 익스트렉션에 비해 긴장감도 액션도 질이 떨어진다. 한국 영화 치고 괜찮은 액션이란 건 슬픈 현실. "
"481","다만 악에서 구하소서","4","한국판 익스트렉션. 하지만 익스트렉션에 비해 긴장감도 액션도 질이 떨어진다. 한국 영화 치고 괜찮은 액션이란 건 슬픈 현실. "
