"","movie","point","review"
"482","정도","1","* 되게 유치하고 재미없네~ 가수 헨리가 중국인? 박푱시기는 밥은 먹고 다니냐?ㅋㅋㅋ "
"483","강철비2: 정상회담","6","넘 판타지느낌? 재밌긴했는데 별로 와닿지 않는 내용이네요ㅠㅠ그냥저냥 재밌었어요 "
"484","장난스런 키스","4","왕대륙 얼굴만 아니었으면 1점이다 장즈수 OOO아 "
"485","내 사랑","10","최고입니다 ㅠㅠ 꼭보세요!! "
"486","다만 악에서 구하소서","10","와..진짜 역대급영화... "
"487","모노노케 히메","10","뒤에 쫌 잔인한데 스토리 내용은 정말 감동적이에요 꼭 봐보세요! "
"488","다만 악에서 구하소서","8","쉴새없이 몰아치는 영화. "
"489","#살아있다","8","나도 극중에 장비 하나쯤은 장만해야겠다는 생각하며 영화봤어요 "
"490","다만 악에서 구하소서","6","해외 로케라 제작비 절약해야됐었나? 차라리 청불로 잔인하게 만들지..연기력은 좋은데 스토리도,연출도 헛점이 많음.총격씬 어이없드만ㅋㅋ전쟁영환줄~주인공만 피해가는 총알이란ㅎㅎ박정민은 단연 최고였다!!! "
"491","다만 악에서 구하소서","6","해외 로케라 제작비 절약해야됐었나? 차라리 청불로 잔인하게 만들지..연기력은 좋은데 스토리도,연출도 헛점이 많음.총격씬 어이없드만ㅋㅋ전쟁영환줄~주인공만 피해가는 총알이란ㅎㅎ박정민은 단연 최고였다!!! "
"492","애니멀 크래커","6","어른이  보기에는  쫌  그런데요  감동은  있네요   초딩 고학년이 보기에는  아닌거 같아요  유치원생들  추천  합니다~^^ "
"493","다만 악에서 구하소서","6","박정민 연기만 기억에 남음 스토리 액션 평범 "
"494","말모이","10","재미없었다는 사람도 있지만 그시대를 생각하며 울컥울컥했음. "
"495","다만 악에서 구하소서","5","짧은 대사,화려한 몸빵액션!말보다 주먹~지루함은 없다.단순한 스토리에 실망은 말자.원빈과 리암리슨이 본다면 어?어디서 많이 본건데?이럴 수 도?남자라면 킬링타임정도는 될것같다. "
"496","다만 악에서 구하소서","2","다만 아기를 태국에서 구하소서 "
"497","반도","1","기대가 컸던가..기대한거 2배의 실망감이..스토리 완전 부실...개연성 부실..감독이 매드맥스의 액션을 하고 싶었던듯...그러나...인랑이 되버린 주인공...연기잘하는 배우분들을 이렇게밖에 못쓰나...이래서 연출과 스토리가 중요합니다. 연기잘하는 분들도 이런 상황에서는 연기발이 안서게 찍히네요..에휴...스토리도 연기도 연출도 그냥 반쪽의 반의반. 그래서 반도...기아 모하비의 튼튼함을 강조하고 싶었던 영화아닌 광고영상이라고하는게 맞을듯.. "
"498","오만","6","iptv에 있어서 보았는데너무 뻔한 내용이길래 후반부는 어떨가 싶어서 계속 보았고결과는 역시나 너무 뻔함.결과가 너무 뻔한만큼 내용도 너무 현실적이기에보면서 남주에게 짜증이 났다.내가 모르는 아름다운 해피엔딩은 없는 것일까?여주는 이뻣고, 남주는 현실적이지 않게 훈남인게 작은 흠이다.하긴 남주마저 찐따처럼 생겼으면 다큐멘터리라고 해야하지 않을까 싶다. "
"499","다만 악에서 구하소서","10","황정민의 연기력은 말할 것도 없고 이정재는 그냥 GD, 박정민의 재발견 "
"500","다만 악에서 구하소서","9","잘봤어요 재미있어요믿고 보는 연기파 배우님들 "
"501","강철비2: 정상회담","10","이런 평점테러는 무엇!? 원작이 웹툰입니다. 다들 한연기 하구요 현실인물들에 겹쳐집니다. 내용은 꽤나 현실성 있고 현재 한국의 위치에서 곱씹어 볼만한 내용이구요. 추천합니다.평점 테러에 대응하여 좀더 얹은 점수10점... "
"502","소년시절의 너","10","진짜 미쳤음 대박 사건 역대급 개인생영화,,, 진짜 넘 몰입해서 봤어요 ㅠㅠㅠ 주인공들 연기 넘 잘해요 짱임 꼭 보세요 "
"503","강철비2: 정상회담","10","정우성 잘생겼어요~~ 미국대통령 넘 재밌었음 "
"504","다만 악에서 구하소서","9","기대하고 봤는데 첨엔 뭔 내용인가 하다가 나중엔재밌더라구요 감동적이고 눈물도 훔치고 연기도 훌륭했습니다 "
"505","헌터 킬러","10","가슴이  웅장해진다 이건 걸작이다 그다지 흥행안한것같은데 꼭 봐야할 영화 "
"506","강철비2: 정상회담","1","이따위것도 영화라고 만들어놨냐 이젠 지겹지도않나 이런영화...보다가 토악질날뻔! 반일친북영화 그만 좀 해쳐먹어라 "
"507","다만 악에서 구하소서","10","황정민 배우분이 액션할때 슬로우 모션 걸리는데 그게 너무 멋졌어요!! 갓 15세 넘어간 분들한테는 좀 잔인할지도 모르겠어요ㅠㅠ "
"508","인베이젼 2020","1","이런 쓰레기를 수입해 와서 돈 벌려고? 근래 봤던 영화중에 최악이다. 영화보다기 토나올 뻔 한 적은 살면서 처음이다 진짜. "
"509","다만 악에서 구하소서","10","아주 잼나네요최근 영화중 히트네요 "
"510","다만 악에서 구하소서","10","재밌다재밌다재밌다재 "
"511","다만 악에서 구하소서","6","약간에 지루함이 동반되지만 그래도 볼만함 "
"512","다만 악에서 구하소서","10","배우들의 연기가 돋보였어요 "
"513","출국","10","북한이랑 평화타령하는 인권팔이들 싹 묶어서 북송시켜드리고싶은 영화에요 ? "
"514","다만 악에서 구하소서","10","본시리즈가 나올때마다 열광했었는데뛰어넘는 액션영화임시원하고 깔끔해서 간만에 행봌했음이게 영화지! "
"515","다만 악에서 구하소서","2","진짜 더러운 영화임 게이 나오고더러워서 중간에나옴.그냥 연기만잘함 내용이쓰레기임 "
"516","다만 악에서 구하소서","10","<다만악> 장르가 범죄 액션영화 인데 액션만 재밌으면 된거지~굳이 여기서 개연성이랑 스토리를 왜 찾는건지??^^이해가 안된다는!! 그렇게 따져서 영화볼거면 스토리 완성도 높은 그런 영화를 찾아서 보세요 ㅎㅎㅎ 괜히 쓸때없이 평점들 낮게 주지말구요. "
"517","#살아있다","2","우선 2점을 준 이유~~^내가 딱 두번 놀라서 2점 줍니다~~아인이 옆집 산악인 집에서 1번 놀람 ㅋ이런게 좀비영화라서 2번 놀람 ㅋ좀비물이면 적어도 실감나는 연기 주변환경등등 이건 너무 현실감 제로 ㅋ우째 도끼로 찍어도 피한방울 안묻어~~ㅋ여주 좀비를 그리죽여도 옷은 새옷 깨끗 ㅋ얼굴에 피한방울 안튀김 ㅋ로프로 반대편 한번 밀어서 건너감 대박 ㅋ 마지막이 관건 헬기에서 총으로 난사 죽은 좀비 바닥에 거이 없음 ㅋ 걍 보지마세요. 진라면 너구리 짜파구리 석수만 기억에 남는 영화 ㅋ "
"518","다만 악에서 구하소서","10","정말 연기력 인정 짱~!!!! "
"519","다만 악에서 구하소서","10",""
"520","타이타닉","10",""
"521","강철비2: 정상회담","8","평화통일이 뭐길래 ㅠㅠ "
"522","다만 악에서 구하소서","10","이정재와 황정민의 연기 액션에 몰입감 최고입니다.스토리 살짝 빈약한게 아쉽네요 ㅠㅠㅠ "
"523","반도","10","다들 재미없다길래 봤는데 전 진심 배우분들 연기 잘 하고 내용도 좋던데요..? 아 강동원님 너무 멋져요..ㅜㅜ "
"524","강철비2: 정상회담","10","연기파들이 많고, 북한측 인사 설정이 딱 맘에 드네요 "
"525","조커","8","주인공의 연기가 살아있다. 메세지가 있는 영화다. "
"526","다만 악에서 구하소서","9","라이트하게보면 10점 ㅎㅎ딥하게보면 9점 ㅎㅎ 러닝타임때문 "
"527","빅샤크3: 젤리몬스터 대소동","1","제목이 빅샤크인데 상어한번나옴 상어 별짓안함 "
"528","감쪽같은 그녀","9","진부한이야기 어색한사투리근데 난 펑펑울며 봤다ㅠ아 괜히봐서  눈땡땡붓고 너무 울어 머리가아프다ㅠ 아역중 사투리연기는 우람이가 짱 "
"529","다만 악에서 구하소서","5","스토리예상하고 보면 100%그 스토리연기는 최고 "
"530","다만 악에서 구하소서","6","액션물과 배우분들을 좋아해서 봤는데요.. 15세 치고 좀 많이 잔인했던 것 같아요 좀 리얼하게 베고 자르고 하는 장면이 많아서 중간중간 눈감고 봤네요. 그거 빼곤 액션씬 좋았어요. 그리고 스토리가 약간? 좀 빈약한 것도 좀 있네요. 아 배우분들 연기 다 잘하시는데 특히 박정민님이 제일 인상깊었네요. "
"531","다만 악에서 구하소서","6","액션씬은 좋았지만 스토리가 뻔하디 뻔함 "
"532","강철비2: 정상회담","1","판타지 영화 잘봤습니다. "
"533","트루스 오어 데어","8","OCN에서 방영해주길래 생각없이 보기 시작했는데 흡입력에 놀랬다. 정말 집중해서 빠져들게 만드는 신박한 스토리. 결말도 허무한 해피엔딩일 줄 알았는데 의외의 결말이라서 놀람. 미국스러운 공포영화- 나는 네가 지난 여름에 한일을 알고 있다 또는 데스티네이션 과 비슷한 느낌! "
"534","드래곤볼 Z : 부활의 F","1","작붕도 심하고 연출도 허접하고 설정도 마구파괴 기존 올드팬 바보만든 애니메이션. 역대 극장판중 가장 화질은 좋지만 가장 작화는 허접함. 전투씬은 거의 실망의 연속이네. "
"535","강철비2: 정상회담","10",""
"536","강철비2: 정상회담","6","실제 있었으면 하는 바램이 있는 영화였지만 그닥 눈길을 끌지는 못하네요~ 임팩트가 약간 부족.... "
"537","다만 악에서 구하소서","10","액션씬은 어떤영화보다 뒤쳐지지않았고 연기또한 최고임.. "
"538","다만 악에서 구하소서","10","최강얙션.최강연기.스토리는 단순하지만 역시.. "
"539","엑시트","10","손에땀을쥐고봤읍니다. "
"540","다만 악에서 구하소서","2",""
"541","먼 훗날 우리","10","두 사람이 헤어진 것 보다 서로만 바라봤던 순수함을 잃게 만든 현실이 안타까웠다. 징첸이 변해가는 모습과 원인들을 실제 겪고 있을 사람이 생각보다 현실에 많을거고 나도 같은 감정을 경험한적이 있는 것 같아서 보는 내내 눈물이 멈추지 않았다. 연기 연출 스토리 삼박자가 너무 좋은 명작이지만 거기서 오는 과몰입에 너무 힘들어서 다신 못볼 것 같은 영화. "
"542","글래스 죠","2","스토리 자체는 괜찮았던거 같은데 스토리 안에 내용이 전반적으로 부실함. 너무 많은걸 담으려고 했던게 실수임. 전개속도가 6g수준으로 흘러감. "
"543","다만 악에서 구하소서","8","역시 두배우의 연기는 두말하면 잔소리!근데 이거 휴먼영화임? 엄청 울었음...ㅜㅜ기대이상! "
"544","지푸라기라도 잡고 싶은 짐승들","2","영화 발로 만들었냐? ㅋㅋㅋ 진짜  개 노잼 "
"545","크롤","7","엑스텐션 P2 힐스아이 피라냐의 감독. 믿고 보는데 아직 여전했다. 여주가 아빠 발견하고 바로 911 전화했으면 이 사단까지는 안났을텐데 아쉽고, 악어들이 카야 한테만 살짝 무는 것도 개연성이 떨어지지만, 그래도 영화 전체적으로 긴장감 좋았다 "
"546","서울역","6","연상호식 메세지 "
"547","다만 악에서 구하소서","10","일단 지드레곤 닮은(?)이정재씨가 넘 멋있어요. ㅋㅋ황정민씨도 인터넷에 뜬 어릴적 사진을 보고 보니 넘 잘생기고 멋있다라는 생각이 들더라구요. 박정민씨는 그 역할이 넘 잘 소화하셔서... 감탄이 나오더라구요. ‘그것만이 내 세상’ 영화보고 정말 대단하다 생각했는데... 역시b전... 개인적으로 스토리도 좋았어요. 의미도 있었고요. 영화 ‘테이큰’ 이 생각나긴 했지만... 그래서 더 좋았어요. 비교도 되고... 부성애에 대해서도 생각하게 되고. 처음 시작할때의 의미는 망각되고 목표만을 향해서 폭주하는 레이는 마치 성과주의적인 세태를 보여 주는 것 같았고요. 결국 두 종류의 악은 자멸하고 순수한 아이와 선의의 행동을 한 비주류인 사람이 낙원을 누리게 되는...다만 개인적으론 박명훈씨의 연기가 좀 어색하게 느껴지긴 했어요. 재밌었어요~ "
"548","터미네이터: 미래전쟁의 시작","5","이상하게 한국에서만 수작이라고 평가받는 망작 재평가를 해서 조금 좋아졌지 망작인건 다름없다 "
"549","다만 악에서 구하소서","10","심장이쫄깃~~! 수출해도 흥행할거같아요 왠만한 헐리우드액션영화보다 훨씬잼있어요 "
"550","다만 악에서 구하소서","6","음.... 지금볼영화중엔 젤나은듯 근데 평점9점대는 절대아니고 한 7.5정도 영화 보면앎 "
"551","고백","10","세상 아이러니한게 악을 악으로 갚아선 안된다면서 그 악의 장본인들의 교화를 위해 돈들여 시설짓고 먹이고 재우고. . 그리곤 증거 불충분. ..마지막 대사처럼 모든 복수를 장난이라고 치부해야 할 정도로 현실에선 일어날 수 없는. . 해서는 안될 또다른 악으로 평가되고. . 분노하다가도 슬퍼지는 영화였다. "
"552","유열의 음악앨범","10","김고은님과 정해인님의 연기가 정말 최고였습니다! "
"553","다만 악에서 구하소서","6","익스트렉션 생각이 자꾸나고.... 넷플릭스 영화가 더 잼나고.... 이정재님은 자꾸 총알이 두개가 박혔다는 톤으로 얘기하시니 웃음만 ㅜ.ㅜ그냥 그래요 "
"554","이터널 선샤인","10","예전엔 지루해서 보다가 잠들었는데.. 다시 보니 정말 명작이다. 밑바닥까지 다 보이고 상처 준 사람일지라도 한때는 너무 아름다웠기에.. 그 기억까지 잊어야 한다는 건 너무 잔인한 일이다. "
"555","다만 악에서 구하소서","10","액션을 위한 영화네요 굿굿 "
"556","팬데믹","2","아오재미없어!진짜 진짜 할말을 잃게 만드는 영화 내머릿속이 팬데믹왔다. "
"557","살인의 추억","10",""
"558","열혈형사","10","재미있네요. 화이팅!!! "
"559","다만 악에서 구하소서","10","오랜만에 제대로 된 영화나온듯!! 강추! "
"560","다만 악에서 구하소서","8","신세계를 상상하고 보면 안됨.. 그냥 보면 상당히 잘만든 영화.. 스토리가 진부하지만 연기력으로 덮음.. 신세계는 황정민이라면.. 이 영화는 이정재다.. 박정민 왤캐 잘어울리냐... "
"561","다만 악에서 구하소서","10","온갖 악이 혼재되어 있어요. "
"562","다만 악에서 구하소서","10","이번에 개봉한 영화중에 제일 재미있었음,스토리는 약간 뻔한데 긴장감있고 배우들이 연기도 너무 잘해서 흥미진진했음 특히 이정재 배우님 역할이 정말 찰떡 같아서 너무 멋있었음 "
"563","다만 악에서 구하소서","7","전체적인 스토리에서 테이큰의 향기가 "
"564","엔더스 게임","6","우리가 흔히 말하는 사람 죽여놓고 미안하다면 다야? 인 영화 "
"565","변산","10",""
"566","다만 악에서 구하소서","9","이정재는 마치 빅뱅 지디보는줄..박정민 연기 압권 "
"567","피아니스트","10","일제강점기 영화보는것보다 더 불편했어요내가 과몰입한건지 영화를 잘 만든건지...아무튼 최고ㅠ "
"568","강철비2: 정상회담","8","국뽕은 생각보다 심하지 않았고, 약간 의아한 웃음코드 연출이 있었습니다만, 잠수함 액션 하나만으로 만족스러운 영화였습니다. "
"569","다만 악에서 구하소서","6","배우님들이 이 영화를 살린거같아요 연기에 감탄하고 스토리에 실망 했어요 ~스토리가 조금 알차면 더 재밌지 않을까 싶네요 요즘 나오는 영화들이 재미없어서 너무 기대한 탓일까요 "
"570","다만 악에서 구하소서","10","이정재 연기력 다시봤음 "
"571","헌터 킬러","10","개꿀잼 우리나라가 이렇게 영화를 만들었다면천만은 걍 넘었을듯 극장에서 못본게 안타까울뿐 "
"572","다만 악에서 구하소서","1","황정민 이정재 연기 잘하는건 다 아는 사실이고 영화에 대한 평점이나 똑바로 남기시길 어디서 본 장면 복붙에 클라셰 우려먹기 지겹다 지겨워 "
"573","강철비2: 정상회담","1","고등학교 나와~~~~ "
"574","반도","8","왜?? 저는 재밌게 봤어요~~~~ 평점 7~8정도 맞는듯. 부산행 반도 못따가 간다고해서 반도라는데 저는 잘 즐기고 봤습니다. 스토리도 뭐~ 괜찮았어요 "
"575","다만 악에서 구하소서","8","스토리는 1차원 적인데 살아있는 캐릭터들과 영화배경을 해외에 둔점이 신선하고 재밌게 느껴졌다. 특히 촬영감독님 열일하심 최고 "
"576","다만 악에서 구하소서","2","노잼.. 보다가 잔 영화는 처음 "
"577","강철비2: 정상회담","2","한마디로 dog판돈주고 보면 시간이 아깝습니다잠수함싼만 다소 만족기대히시면  실망이 커요~ "
"578","반도","9","개인적으로는 재미있었음. 스토리도 나쁘지 않음. 좀 아쉬운 점이 있다면 레이싱을 너무 오래 끌고 간 것 정도? 그래도 재미있었다 연기도 하드캐리하고. "
"579","미스 포터","10","그림이랑 배경이 넘 이뻐서 힐링되는 영화네요. 보는 내내 마음이 참 좋았습니다. "
"580","여군 외출","8","한국 80년대판 미연시 같은 느낌 "
"581","다만 악에서 구하소서","8","황정민은 황정민답게 연기했고이정재는 잘생겼고 박정민은.... 형 사랑해요(덜렁) "
"582","다만 악에서 구하소서","6","비싼 조미료 덜익은 요리 "
"583","다만 악에서 구하소서","10","무난한 스토리 황정민은 역시 황정민.이정재와 박정민의 새로운 면모를 발견. 황정재...그들은 그저 빛.... "
"584","장난스런 키스","5",""
"585","다만 악에서 구하소서","10","너무 재밌게 봤습니다. 박정민 배우님의 팔색조 연기도 넘 좋았어요ㅎㅎ어쩜 다리가 나보다 더 이뻐ㅋㅋ "
"586","반도","8","..부릉부릉..질주본능 "
"587","다만 악에서 구하소서","10","최고 꼭 보시길 우리나라 영화 발전 많이 했다 "
"588","반도","10","진짜 재밌어요 ㅠㅠ 팝콘 먹으면서 영화관에서 재밌게봤네요 "
"589","걸캅스","10",""
"590","다만 악에서 구하소서","10","휴가중이라 개봉일 당일날 오전에 보러갔었는데 완전 꿀잼~ 배우들의 연기력과 영상미에 감동받았습니다 ^^ "
"591","다만 악에서 구하소서","9","짜증나는 여름 시원했네요 "
"592","캐리비안의 해적: 죽은 자는 말이 없다","10",""
"593","강철비2: 정상회담","1","진짜 내인생 최악의 영화 공산주의자가 아니고서는 진짜 재밌게 볼수가없다. 개연성도 없고 연기도 쓰레기고 그냥 최악 "
"594","다만 악에서 구하소서","10","배우들의 연기가 넘 멋지다.특히 황배우.다른배우도 두말필요 없음메다 "
"595","다만 악에서 구하소서","10","초큼 잔인한부분?들도 있어서 무서웠지만(시각보단 청각이 엄청 시끌)ㅋㅋ 적당히 긴장감있고 보는내내 어떡해 하는 감정을 쫄깃하게 만들었던 영화스토리 구성이나 개연성도 괜찮았던것같고. 액션신도 허술한 부분 없이 잘만든거 같았어용, 뭣보다 나오는 주조연 배우들 연기가 아주 굿굿. 재밋게본 액션영화중 하나로 남을거같아요 "
"596","다만 악에서 구하소서","8","명불허전 황정민 ..이정재는 무섭다 진짜 저런사람이 있을까싶기도 하다있겠지.. 재미있게 봤음 "
"597","다만 악에서 구하소서","9","박정민이란 배우에 팬이되어버린.. 기대없이 봤는데 엄청 몰입해서 봤어요^^ "
"598","화이 : 괴물을 삼킨 아이","8","대배우들의 모임 ..슬의생 유연석부터 쀼세계 박해준까지 주연급 배우 모음집 이라 젊은 훈남 준영이 아빠 를 볼수 있다17살의 나이와 관계없는 여진구의 풋풋한듯 하지만 농익은 연기를 볼수 있다. 연출이 많이 아쉽네요 너무 모든 배우님들 기가 세셔서 그러셨나. 전체적으론 평점 7.3점이 딱 맞음. "
"599","그 시절, 우리가 좋아했던 소녀","10","제일 잘 만든 첫사랑 영화 "
"600","다만 악에서 구하소서","10","생각보다 기대보다 충분히 재밌다. "
"601","강철비2: 정상회담","1","참! 어이없음~~이제껏 보았던 최악의 영화 어떻게 억지로 꿰맞춰도 이런 억지가 있을까 감독 머리속엔 오로지 문씨에게 충성  북괴  살찐돼지에게 충성~ 틀린 얘긴 아니죠 "
"602","애니멀 크래커","10","아이와 같이 봤는데아이가 너무 신나고 즐거워 했습니다극장의 볼륨이 조금커서 귀는 조금 부담되었습니다 "
"603","강철비2: 정상회담","10","진짜 기대하구 본 영화중에 젤루 실망한 영화... "
"604","강철비2: 정상회담","5","억지전개..초반만 보더라도 예측 가능한 스토리. 태풍같은 기상이변은 너무 식상한게 아닌지...그리고 반란으로 남 북 미 셋이 잠수함에 납치 된다고...? 이렇게 진행 할거면 구출은 아이언맨한테 부탁합시다. "
"605","반도","2","재미도 감동도 무!CG의 향연... "
"606","강철비2: 정상회담","1","이런거 돈내고보는 저능아들 없지? "
"607","딥워터","7","보는데 딱히 불편함 없었다, 1시간 20분이라는 요즘 영화치곤 짧은 런타임이였지만 무엇을 보여주고 하는지 간결하게 보였고, 긴장감도 있었다. "
"608","다만 악에서 구하소서","9","배우들이 다 한거같아요.연기 최고~ 결말이 좀..이걸 기뻐해야할지 슬퍼해야할지;; "
"609","강철비2: 정상회담","10","대사나 스토리가 진짜 와..남들은 그냥 웃고 넘길 수도 있는 부분들이 진짜 소름돋게 기가막히게 만들었다. 허튼 대사나 설정이 없는 것 같다. "
"610","강철비2: 정상회담","9","독도에 대한 독도에 의한 충분히 생각할 만한 이야기 "
"611","다만 악에서 구하소서","1","스토리 : 0개연성 : 0현실성 : 0액션 : 0.2연기 : 0.8정말 재미있는 영화는 사족이 필요없습니다. 다만악의 영화평들을 보면 액션이 좋내, 촬영이 끝내주내, 배우들 연기가 죽이내 등등 다시말해 그것 말고는 볼것이 없다는 뜻이기도 합니다.전 영화 보다가 중간에 나갈까? 하는 생각을 할정도의 영화 였습니다.그나마 너무나 잘하는 연기자들을 보며 안타까운 생각까지 들었습니다.스토리는 너무나 뻔하고, 개연성 이라고는 1도 없으며, 촬영과 액션에 많은 신경을 쓴것이 느껴지기는 하지만 스토리와 개연성이 없는 액션에 1도 몰입할수 없었으며, 거기에 신파까지...이 영화를 극찬하는 분들을 보면서 감상평을 꼭써야 겠다고 생각했습니다.시원한 진짜 액션 영화를 원하신다면, 넷플X스 의 익스트랙션 을 추천합니다. "
"612","다만 악에서 구하소서","10","올해 영화중 제일 집중하느라 화장실도 못가게 만든 그런 영화 ^^ "
"613","다만 악에서 구하소서","2","겁나 기대하고 봤다가 빈약한 빈스토리에 졸다나옴여자들은 멋있다고 난리.. 남자인 내가 볼땐 배우빨로 스토리를 커버함. "
"614","다만 악에서 구하소서","10","액션 카메라가 뭔가 색다름 개꿀잼 시간 없어짐 "
"615","다만 악에서 구하소서","10","크...이런게 바로 액션이지. 강추입니다. "
"616","하울의 움직이는 성","10","성우가 일본 한국 둘다 너무좋았음 "
"617","하울의 움직이는 성","10","성우가 일본 한국 둘다 너무좋았음 "
"618","다만 악에서 구하소서","10","생각하지도 못한 박정민.. 그녀가 이 영화의 키다. "
"619","다만 악에서 구하소서","8","재미있음 "
"620","강철비2: 정상회담","1","이것도 영화라고 만드냐 "
"621","브레이킹 던 part1","10",""
"622","다만 악에서 구하소서","8","내용은 흔하고 단순하다. 몇몇 설정과 개연성은 좀 망가지기도 한다. 대신 액션이 멋지다. 내용을 복잡하게 꼬는 대신 멋진 액션 한 장면 더 넣고, 칼에 찔리고도 쓰러지는 대신 훨훨 날아다니며 멋진 액션 한 번 더 보여주는 그런 영화다. 15세 관람가라는 게 아쉽다. "
"623","다만 악에서 구하소서","10","수류탄 파밍잘해야야해.. "
"624","센과 치히로의 행방불명","10",""
